{"schema":"jin-math-knowledge-node/v1","knowledge_id":"K-0003","kind":"theorem","title":"显式无零区域：从经典区域到 2026 年记录","classification":{"subject":{"scheme":"MSC2020","primary":"11M06","secondary":["11M26","11Y35"]},"object_tags":["riemann-zeta-function","zero-free-region"],"method_tags":["trigonometric-polynomial","exponential-sum","explicit-estimate"]},"statement":"无条件理论已在 \\(\\Re s=1\\) 左侧建立随高度收窄的无零区域。经典 de la Vallée Poussin\n型区域形如 \\(\\sigma\\ge 1-c/\\log |t|\\)；Vinogradov–Korobov 型区域形如\n\\(\\sigma\\ge 1-c(\\log |t|)^{-2/3}(\\log\\log |t|)^{-1/3}\\)。\nMossinghoff–Trudgian–Yang（正式发表）证明：当 \\(|t|\\ge3\\) 时，\n\\[\n\\sigma\\ge1-\\frac1{55.241(\\log|t|)^{2/3}(\\log\\log|t|)^{1/3}}\n\\]\n无零，并给出对 \\(|t|\\ge2\\) 有效的经典形常数 \\(5.558691\\)。\nBellotti–Trudgian–Yang 的 2026-03 预印本进一步声称：对 \\(t\\ge3\\)，\n\\(\\sigma\\ge1-1/(4.896\\log t)\\) 无零。后者在本仓库仅作为 source-reported preprint 记录。","assumptions":["高度变量取实数且满足各来源的明示下界；常数与区域形状不可跨来源混用。"],"scope":"只覆盖 ζ 函数靠近 \\(\\Re s=1\\) 的无零区域及显式常数；截至 2026-08-29。","conventions":["\\(s=\\sigma+it\\)。","正式发表结果与 2026 预印本分开标注。"],"prerequisites":["K-0001","K-0002"],"relations":[{"type":"uses_method","target":"K-0015"},{"type":"motivates","target":"K-0005"},{"type":"applies_to","target":"K-0007"},{"type":"applies_to","target":"K-0008"}],"authority":{"status":"reference_only","receipt":null,"shared_result":null},"source_refs":["M. J. Mossinghoff, T. S. Trudgian, A. Yang, Explicit zero-free regions for the Riemann zeta-function, Res. Number Theory 10 (2024), Article 11, DOI 10.1007/s40993-023-00498-y.","C. Bellotti, Explicit bounds for the Riemann zeta function and a new zero-free region, J. Math. Anal. Appl. 536 (2024), 128249; arXiv:2306.10680.","C. Bellotti, T. Trudgian, A. Yang, Zero-free regions inspired by work of Heath-Brown, arXiv:2603.21490v1 (2026-03-23), preprint.","A. Yang, Explicit bounds on ζ(s) in the critical strip and a zero-free region, arXiv:2301.03165."],"cannot_imply":["靠近 \\(\\Re s=1\\) 的无零区域不排除 \\(1/2<\\Re\rho<1-c/\\log|\\Im\rho|\\) 内的零点。","改善常数或渐近形状不等于证明 RH。","预印本中的 4.896 常数未在本仓库独立复现或同行评议。"]}
