{"schema":"jin-math-knowledge-node/v1","knowledge_id":"K-0012","kind":"equivalence","title":"de Bruijn–Newman 常数与热流临界性","classification":{"subject":{"scheme":"MSC2020","primary":"30D15","secondary":["11M26","11Y35"]},"object_tags":["riemann-xi-function","de-bruijn-newman-constant","heat-flow"],"method_tags":["real-zero-preserver","heat-equation","rigorous-computation"]},"statement":"对 Riemann \\(\\Xi\\) 核的热流变形 \\(H_t\\)，存在常数 \\(\\Lambda\\)，使得\n\\(H_t\\) 的全部零点为实数当且仅当 \\(t\\ge\\Lambda\\)。\nRH 等价于 \\(\\Lambda\\le0\\)。Rodgers–Tao（2020 正式发表）证明\n\\(\\Lambda\\ge0\\)，因此 RH 等价于精确临界命题 \\(\\Lambda=0\\)。\nPolymath 15 给出无条件上界 \\(\\Lambda\\le0.22\\)；Platt–Trudgian 的更高零点验证推出\n\\(\\Lambda\\le0.2\\)。\n2026 年网络上出现 0.1965 与 0.1875 的“certified”上界记录，但本基线未找到足以完成\n作者身份、正式存档与独立证书核验的一致主来源，故将其列入 K-0016 的来源债务而不升级为已确立记录。","assumptions":["使用 de Bruijn、Newman 与 Polymath 15 的标准热流参数方向。","上界改进必须绑定可复现的严格零点/Lehmer-pair 证书。"],"scope":"de Bruijn–Newman 路线的逻辑地位与截至 2026-08-29 已审慎接受的数值边界。","conventions":["\\(\\Lambda\\) 为 de Bruijn–Newman 常数。","RH ⇔ Λ≤0；结合 Λ≥0 后 RH ⇔ Λ=0。"],"prerequisites":["K-0001","K-0002"],"relations":[{"type":"equivalent_to","target":"K-0001"},{"type":"uses_method","target":"K-0015"},{"type":"applies_to","target":"K-0006"},{"type":"motivates","target":"K-0016"}],"authority":{"status":"reference_only","receipt":null,"shared_result":null},"source_refs":["N. G. de Bruijn, The roots of trigonometric integrals, Duke Math. J. 17 (1950), 197–226.","C. M. Newman, Fourier transforms with only real zeros, Proc. Amer. Math. Soc. 61 (1976), 245–251.","B. Rodgers, T. Tao, The de Bruijn–Newman constant is non-negative, Forum Math. Pi 8 (2020), e6, DOI 10.1017/fmp.2020.6.","D. H. J. Polymath, Effective approximation of heat flow evolution of the Riemann ξ function, and a new upper bound for the de Bruijn–Newman constant, Res. Math. Sci. 6 (2019), 31; arXiv:1904.12438.","D. Platt, T. Trudgian, The Riemann hypothesis is true up to 3·10^12, Bull. Lond. Math. Soc. 53 (2021), 792–797."],"cannot_imply":["证明 \\(\\Lambda\\) 很小且为正的上界不能推出 \\(\\Lambda=0\\)。","Λ≥0 被形容为“RH 若真则刚好为临界”并不提供 Λ≤0。","未经独立核验的 2026 证书声称不能作为仓库权威上界。"]}
