{"schema":"jin-math-knowledge-node/v1","knowledge_id":"K-0005","kind":"theorem","title":"零密度估计与 Guth–Maynard 2026 突破","classification":{"subject":{"scheme":"MSC2020","primary":"11M26","secondary":["11N05"]},"object_tags":["riemann-zeta-function","zero-density","dirichlet-polynomial","prime-short-interval"],"method_tags":["large-values-estimate","dirichlet-polynomial","mean-value-estimate"]},"statement":"令 \\(N(\\sigma,T)\\) 计数 \\(0<\\Im\\rho\\le T\\) 且 \\(\\Re\\rho\\ge\\sigma\\) 的非平凡零点。\n零密度理论不逐个排除离线零点，而是控制它们随 \\(T\\) 增长的数量。\nIngham、Huxley 等建立了经典密度估计；“density hypothesis”预期\n\\(N(\\sigma,T)\\ll_\\varepsilon T^{2(1-\\sigma)+\\varepsilon}\\)。\nGuth–Maynard 在 2026 年 Annals of Mathematics 正式发表的 Dirichlet 多项式大值估计推出\n\\[\nN(\\sigma,T)\\le T^{30(1-\\sigma)/13+o(1)}\n\\]\n以及长度 \\(x^{17/30+o(1)}\\) 的短区间中素数分布渐近式。\n这是 2026 年已发表、会实质改变零密度路线评估的结果。","assumptions":["通常固定 \\(1/2<\\sigma<1\\) 并令 \\(T\\to\\infty\\)；精确统一范围以原文为准。"],"scope":"零密度路线及其对素数短区间的应用，不包含逐零点定位；截至 2026-08-29。","conventions":["\\(N(\\sigma,T)\\) 包含重数。","\\(o(1)\\) 的参数依赖与统一性必须回到原文核查。"],"prerequisites":["K-0001","K-0002"],"relations":[{"type":"uses_method","target":"K-0015"},{"type":"applies_to","target":"K-0007"},{"type":"contrasts_with","target":"K-0004"},{"type":"motivates","target":"K-0016"}],"authority":{"status":"reference_only","receipt":null,"shared_result":null},"source_refs":["L. Guth, J. Maynard, New large value estimates for Dirichlet polynomials, Ann. of Math. 203 (2026), 623–675, DOI 10.4007/annals.2026.203.2.6.","A. E. Ingham, On the estimation of N(σ,T), Quart. J. Math. Oxford 11 (1940), 291–292.","M. N. Huxley, On the difference between consecutive primes, Invent. Math. 15 (1972), 164–170."],"cannot_imply":["对每个固定 \\(\\sigma>1/2\\) 的次幂密度控制不等于 \\(N(\\sigma,T)=0\\)。","短区间素数渐近式不推出 RH 所要求的平方根级误差。","该节点未断言显示指数在全部 \\(\\sigma\\) 区间逐点优于每个既有估计；比较需按原文适用范围进行。"]}
