{"schema":"jin-math-knowledge-node/v1","knowledge_id":"K-0009","kind":"equivalence","title":"Robin 与 Lagarias 的初等不等式判据","classification":{"subject":{"scheme":"MSC2020","primary":"11A25","secondary":["11N37","11M26"]},"object_tags":["divisor-sum-function","harmonic-number","riemann-zeta-function"],"method_tags":["extremal-integer","explicit-inequality"]},"statement":"令 \\(\\sigma(n)=\\sum_{d\\mid n}d\\)，\\(\\gamma\\) 为 Euler 常数。Robin（1984）证明 RH 等价于：\n对每个整数 \\(n>5040\\)，\n\\[\n\\sigma(n)<e^\\gamma n\\log\\log n.\n\\]\nLagarias（2002）给出不显式出现 \\(\\gamma\\) 的初等等价式：对每个 \\(n\\ge1\\)，\n\\[\n\\sigma(n)\\le H_n+\\exp(H_n)\\log H_n,\n\\]\n其中 \\(H_n=\\sum_{k=1}^n1/k\\)（按原文处理小 n 与等号）。\n极值分析可缩到 colossally abundant 等稀疏整数族，但仍保留无穷量词。","assumptions":["n 为正整数；对数为自然对数。"],"scope":"两个最常用的整数不等式 RH 等价判据及其量词边界。","conventions":["\\(\\sigma(n)\\) 为除数和函数。","\\(H_n\\) 为第 n 个调和数。"],"prerequisites":["K-0001"],"relations":[{"type":"equivalent_to","target":"K-0001"},{"type":"uses_method","target":"K-0015"}],"authority":{"status":"reference_only","receipt":null,"shared_result":null},"source_refs":["G. Robin, Grandes valeurs de la fonction somme des diviseurs et hypothèse de Riemann, J. Math. Pures Appl. 63 (1984), 187–213.","J. C. Lagarias, An elementary problem equivalent to the Riemann hypothesis, Amer. Math. Monthly 109 (2002), 534–543, DOI 10.2307/2695443."],"cannot_imply":["检查很大的有限 n 范围仍不能覆盖所有整数。","把候选反例限制到极值整数族不等于证明该族中永无反例。","数值裕量随 n 的行为必须用严格界控制，不能由图形外推。"]}
