{"schema":"jin-math-knowledge-node/v1","knowledge_id":"K-0013","kind":"reference_map","title":"零点相关、GUE 与随机矩阵证据","classification":{"subject":{"scheme":"MSC2020","primary":"11M26","secondary":["15B52","60B20"]},"object_tags":["riemann-zeta-function","zero-spacing","random-matrix","pair-correlation"],"method_tags":["pair-correlation","random-matrix-theory","numerical-experiment"]},"statement":"Montgomery 的成对相关猜想预言高处 ζ 零点的归一化间距具有与 GUE 特征值相同的局部统计；\n其经典定理只在测试函数 Fourier 支撑受限的范围内证明相应公式。\nOdlyzko 对高位零点的大规模数值计算与 GUE 统计高度吻合。\nKeating–Snaith 等随机矩阵模型进一步预测 ζ 在临界线上的矩、极值和特征多项式统计，\n并成功解释许多已知主项/常数。Rudnick–Sarnak 等对更一般 L 函数取得有限支撑的 n-level\ncorrelation 结果。它们构成强结构证据与猜想生成器，但统计极限允许零密度异常集存在。","assumptions":["零点按平均间距归一化；统计极限的测试函数和支撑限制必须明示。","GUE 模型是类比/渐近预测，不是 ζ 零点的已构造随机矩阵表示。"],"scope":"零点统计的已证有限范围、数值证据与随机矩阵启发。","conventions":["pair correlation 与逐点零点位置是不同量词层级。","GUE 指 Gaussian Unitary Ensemble。"],"prerequisites":["K-0001","K-0002","K-0004"],"relations":[{"type":"uses_method","target":"K-0015"},{"type":"motivates","target":"K-0004"},{"type":"contrasts_with","target":"K-0006"},{"type":"motivates","target":"K-0016"}],"authority":{"status":"reference_only","receipt":null,"shared_result":null},"source_refs":["H. L. Montgomery, The pair correlation of zeros of the zeta function, Proc. Sympos. Pure Math. 24 (1973), 181–193, DOI 10.1090/pspum/024/9944.","A. M. Odlyzko, The 10^20-th zero of the Riemann zeta function and 70 million of its neighbors, AT&T Bell Laboratories preprint (1989).","J. P. Keating, N. C. Snaith, Random matrix theory and ζ(1/2+it), Comm. Math. Phys. 214 (2000), 57–89, DOI 10.1007/s002200000261.","Z. Rudnick, P. Sarnak, Zeros of principal L-functions and random matrix theory, Duke Math. J. 81 (1996), 269–322."],"cannot_imply":["局部统计与 GUE 一致不能排除零密度、甚至无限的离线零点。","矩预测或有限支撑相关定理不能推出所有零点在临界线。","数值拟合不能替代误差项与量词完整的证明。"]}
