{"schema":"jin-math-knowledge-node/v1","knowledge_id":"K-0002","kind":"theorem","title":"ζ 函数的解析结构、零点对称性与素数定理基线","classification":{"subject":{"scheme":"MSC2020","primary":"11M06","secondary":["11M26","11N05"]},"object_tags":["riemann-zeta-function","euler-product","zero-counting-function","prime-number-theorem"],"method_tags":["complex-analysis","explicit-formula"]},"statement":"\\(\\zeta(s)\\) 在 \\(\\Re s>1\\) 有 Euler 乘积，因而该半平面无零点；它延拓为复平面上仅在\n\\(s=1\\) 有单极点的亚纯函数。完成函数\n\\(\\xi(s)=\\tfrac12s(s-1)\\pi^{-s/2}\\Gamma(s/2)\\zeta(s)\\)\n是整函数并满足 \\(\\xi(s)=\\xi(1-s)=\\overline{\\xi(\\overline{s})}\\)。\n因此非平凡零点关于实轴和临界线成四重对称；平凡零点位于负偶整数。\nRiemann–von Mangoldt 公式给出高度 \\(T\\) 以下零点数的主项\n\\(N(T)=\\frac{T}{2\\pi}\\log\\frac{T}{2\\pi}-\\frac{T}{2\\pi}+O(\\log T)\\)。\nHadamard 与 de la Vallée Poussin 证明 \\(\\Re s=1\\) 无零点，从而得到素数定理。","assumptions":["使用标准完成函数归一化；零点计数包含重数。"],"scope":"作为所有后续 RH 路线的解析基础；只记录经典已知定理与符号。","conventions":["\\(N(T)\\) 计数 \\(0<\\Im\\rho\\le T\\) 的非平凡零点并计重数。","\\(\\psi(x)=\\sum_{n\\le x}\\Lambda(n)\\)。"],"prerequisites":["K-0001"],"relations":[{"type":"applies_to","target":"K-0003"},{"type":"applies_to","target":"K-0004"},{"type":"applies_to","target":"K-0005"},{"type":"applies_to","target":"K-0006"},{"type":"applies_to","target":"K-0007"},{"type":"applies_to","target":"K-0008"},{"type":"applies_to","target":"K-0010"},{"type":"applies_to","target":"K-0012"},{"type":"applies_to","target":"K-0013"}],"authority":{"status":"reference_only","receipt":null,"shared_result":null},"source_refs":["B. Riemann (1859), original memoir on the number of primes below a given magnitude.","J. Hadamard, Sur la distribution des zéros de la fonction ζ(s) et ses conséquences arithmétiques, Bull. Soc. Math. France 24 (1896), 199–220.","C.-J. de la Vallée Poussin, Recherches analytiques sur la théorie des nombres premiers, Ann. Soc. Sci. Bruxelles 20 (1896), 183–256.","H. von Mangoldt, Zu Riemanns Abhandlung Über die Anzahl der Primzahlen unter einer gegebenen Grösse, J. Reine Angew. Math. 114 (1895), 255–305."],"cannot_imply":["素数定理只需要边界线 \\(\\Re s=1\\) 无零点，远弱于 RH。","函数方程与四重对称不能排除成对出现的离线零点。","零点计数渐近式不给出各零点的实部。"]}
