{"schema":"jin-math-knowledge-node/v1","knowledge_id":"K-0001","kind":"definition","title":"黎曼猜想：精确定义、量词与开放状态","classification":{"subject":{"scheme":"MSC2020","primary":"11M26","secondary":["11M06","11N05"]},"object_tags":["riemann-zeta-function","nontrivial-zero","critical-line"],"method_tags":["complex-analysis","source-audit"]},"statement":"令 \\(\\zeta(s)=\\sum_{n\\ge 1}n^{-s}\\)（最初在 \\(\\Re s>1\\) 定义），并取其亚纯延拓。\n黎曼猜想（RH）的精确命题是：对每一个满足 \\(\\zeta(\\rho)=0\\) 且\n\\(0<\\Re\\rho<1\\) 的非平凡零点 \\(\\rho\\)，都有 \\(\\Re\\rho=\\tfrac12\\)。\n量词是“所有非平凡零点”，并包含按重数计数的零点；它不主张零点全为单零点。\n截至 2026-08-29，Clay Mathematics Institute 仍将该问题列为 Unsolved。","assumptions":["采用经典黎曼 ζ 函数，而非 Dedekind ζ、Dirichlet L 函数或广义黎曼猜想。","零点按解析函数的通常重数理解。"],"scope":"经典黎曼 ζ 函数的 RH；来源审计截至 2026-08-29。该节点只固定问题身份和开放状态，不选择证明路线。","conventions":["\\(\\rho=\\beta+i\\gamma\\)，临界线指 \\(\\beta=\\tfrac12\\)。","非平凡零点指临界带内的零点；负偶整数处的零点称为平凡零点。"],"prerequisites":[],"relations":[{"type":"motivates","target":"K-0002"},{"type":"motivates","target":"K-0003"},{"type":"motivates","target":"K-0004"},{"type":"motivates","target":"K-0005"},{"type":"motivates","target":"K-0006"},{"type":"motivates","target":"K-0007"},{"type":"motivates","target":"K-0008"},{"type":"motivates","target":"K-0009"},{"type":"motivates","target":"K-0010"},{"type":"motivates","target":"K-0011"},{"type":"motivates","target":"K-0012"},{"type":"motivates","target":"K-0013"},{"type":"motivates","target":"K-0014"},{"type":"motivates","target":"K-0015"}],"authority":{"status":"reference_only","receipt":null,"shared_result":null},"source_refs":["B. Riemann, Ueber die Anzahl der Primzahlen unter einer gegebenen Grösse, Monatsberichte der Berliner Akademie (1859).","E. Bombieri, Problems of the Millennium: The Riemann Hypothesis, Clay Mathematics Institute official problem description (2000).","Clay Mathematics Institute, Riemann Hypothesis problem page, status observed 2026-08-29."],"cannot_imply":["“仍未解决”不能推出不存在未审查的声称证明；它只表示没有被权威流程接受的解答。","任何有限高度验证、正比例结果、统计规律或函数域类比都不能推出此处的全称量词。","RH 本身不推出所有零点都是单零点。"]}
