{"schema":"jin-math-knowledge-node/v1","knowledge_id":"K-0010","kind":"equivalence","title":"Li 系数、Weil 正性与显式公式判据","classification":{"subject":{"scheme":"MSC2020","primary":"11M06","secondary":["11M26"]},"object_tags":["riemann-xi-function","li-coefficient","weil-form","explicit-formula"],"method_tags":["positivity","test-function","hermitian-form"]},"statement":"Li 判据令\n\\[\n\\lambda_n=\\frac1{(n-1)!}\\left.\\frac{d^n}{ds^n}\\bigl[s^{n-1}\\log\\xi(s)\\bigr]\\right|_{s=1}.\n\\]\nRH 等价于对所有 \\(n\\ge1\\) 有 \\(\\lambda_n>0\\)（采用标准归一化）。\nWeil 判据把 RH 表述为一类满足 Mellin/Fourier 条件的测试函数上的显式公式 Hermitian 二次型非负；\nBombieri–Lagarias 说明 Li 判据可视作 Weil 正性框架的离散化/特例并推广到一般零点多重集。\n这些判据把“所有零点在直线”转换成“所有阶/所有测试函数的正性”，但没有消除无穷量词。","assumptions":["ξ 函数采用 K-0002 的标准归一化。","测试函数空间、变换约定与极点项必须按具体 Weil 公式版本固定。"],"scope":"RH 的正性等价判据及其逻辑边界；用于后续证书化路线设计。","conventions":["\\(\\lambda_n\\) 指 Li/Keiper 系数。","正性判据的有限截断只构成有限证据。"],"prerequisites":["K-0001","K-0002"],"relations":[{"type":"equivalent_to","target":"K-0001"},{"type":"uses_method","target":"K-0015"},{"type":"motivates","target":"K-0004"},{"type":"motivates","target":"K-0016"}],"authority":{"status":"reference_only","receipt":null,"shared_result":null},"source_refs":["X.-J. Li, The positivity of a sequence of numbers and the Riemann hypothesis, J. Number Theory 65 (1997), 325–333, DOI 10.1006/jnth.1997.2137.","A. Weil, Sur les formules explicites de la théorie des nombres premiers, Comm. Sém. Math. Univ. Lund (1952), 252–265.","E. Bombieri, J. C. Lagarias, Complements to Li's criterion for the Riemann hypothesis, J. Number Theory 77 (1999), 274–287, DOI 10.1006/jnth.1999.2392."],"cannot_imply":["验证有限多个 Li 系数为正不能推出所有系数为正。","在有限维测试函数子空间上正定不能推出完整 Weil 判据。","数值计算出的近似正性必须控制舍入、截断和条件数才可作为有界证据。"]}
