{"schema":"jin-math-knowledge-node/v1","knowledge_id":"K-0016","kind":"knowledge_gap","title":"截至 2026-08-29 的可审计 frontier、来源债务与 Project-genesis 阻塞","classification":{"subject":{"scheme":"MSC2020","primary":"11M26","secondary":["11M06","11N05"]},"object_tags":["riemann-zeta-function","research-frontier","source-debt","project-genesis"],"method_tags":["source-audit","independent-verification","research-planning"]},"statement":"现有结论把 RH 周围的有限/平均/等价结构刻画得很深，但尚缺一个能覆盖“所有非平凡零点”的\n统一闭合机制。对后续研究最重要的不是再复述 RH，而是选择可独立验证的中间 frontier：\n\nA. 对 2026 新结果做独立 source audit：Alpöge–Furman 的 2/3 预印本及 Lean 工件、\nDevine 的 0.673399 证书、Bellotti–Trudgian–Yang 的 4.896 无零区、\nHolland 的 Jensen 楔形；逐项核对依赖、量词、常数、代码/证书与同行评议状态。\nB. 核查网络上关于 de Bruijn–Newman \\(\\Lambda\\le0.1965\\) 与 \\(\\Lambda\\le0.1875\\)\n的 2026 “certified”记录：当前搜索结果存在作者/机构/存档元数据不一致，不能进入 settled baseline。\nC. 建立路线间可验证的桥梁义务，例如：有限压缩/Weil 正性怎样统一到完整测试空间；\nmollifier 新结构怎样跨越现有长度/离对角障碍；函数域中的纯性机制是否有严格数域替代物。\nD. 将任何研究窗口限制为一个精确、可证伪的二级命题，明确成功证据和 cannot_imply，\n而不是以“直接证明 RH”为单一工作单元。\n\n仓库层面，本次只能建立 pre-genesis reference baseline。`projects/P-XXXX--.../` 的受控 v13\ngenesis 仍被仓库 Issue #4（genesis adapter）与 #20（五层 admission/runtime contract）阻塞；\n手工拼装双 head 会违反当前治理。","assumptions":["“来源债务”表示需要核查，不预设结果真伪。","下一 frontier 必须绑定精确 statement、适用范围、证据等级和独立验证方案。"],"scope":"研究调度与来源审计节点；截至 2026-08-29。它不冻结未来 Project objective。","conventions":["settled baseline、source-reported preprint、repository-verified result 三者分离。","Project genesis 只能由仓库受控适配器执行。"],"prerequisites":["K-0015"],"relations":[{"type":"motivates","target":"K-0004"},{"type":"motivates","target":"K-0003"},{"type":"motivates","target":"K-0012"},{"type":"motivates","target":"K-0015"}],"authority":{"status":"reference_only","receipt":null,"shared_result":null},"source_refs":["Clay Mathematics Institute, Riemann Hypothesis problem page, observed 2026-08-29.","L. Alpöge, R. Furman, arXiv:2608.13637v2 (2026-08-19), preprint.","M. Devine, Zenodo 10.5281/zenodo.22066689, version 1.0.3 (2026-08-23), preprint.","C. Bellotti, T. Trudgian, A. Yang, arXiv:2603.21490v1 (2026-03-23), preprint.","J. Holland, arXiv:2608.08682 (2026-08), preprint.","Repository Issue #4, implement controlled v13 Project genesis adapter.","Repository Issue #20, complete five-layer research OS admission and execution contracts v1.","Repository Issue #21, Riemann hypothesis prior-art knowledge baseline work packet."],"cannot_imply":["待审计材料不能被当作已证明、已同行评议或已独立复现。","找到元数据记录或证书包不能自动证明数学结论。","该 frontier 列表不承诺任何路线能解决 RH。","pre-genesis 知识节点不能替代 immutable objective、Project heads 或 verifier receipt。"]}
