{"schema":"jin-math-knowledge-node/v1","knowledge_id":"K-0014","kind":"theorem","title":"有限域函数域中的 RH 类比：Weil 与 Deligne","classification":{"subject":{"scheme":"MSC2020","primary":"11G20","secondary":["14G10","14F20"]},"object_tags":["zeta-function-over-finite-field","algebraic-curve","frobenius-eigenvalue"],"method_tags":["etale-cohomology","algebraic-geometry","spectral-interpretation"]},"statement":"对有限域上的光滑射影曲线，其 ζ 函数的非平凡零点满足与 RH 对应的绝对值条件；\nWeil 证明了该曲线情形。Deligne 证明 Weil 猜想，给出更高维光滑射影簇中 Frobenius\n在 étale 上同调上的特征值具有规定权重。这里的“临界线”通过变量变换对应于\nFrobenius 特征值绝对值 \\(q^{i/2}\\)。\n这些定理展示了“上同调空间 + 自然算子 + 纯性/正性”可以强制零点位置，\n是 Hilbert–Pólya 与谱路线的重要原型；但经典数域 Spec(Z) 尚无可直接复制的完备几何机器。","assumptions":["对象是有限域上的代数簇及其 Hasse–Weil ζ 函数，而非经典 Riemann ζ 的同一证明。","采用标准 étale 上同调与几何 Frobenius/算术 Frobenius约定时需一致转换。"],"scope":"函数域/有限域中的已解 RH 类比及其可迁移与不可迁移边界。","conventions":["“函数域 RH 已解决”不表示经典 RH 是其形式推论。","权重纯性是关键结构，不只是零点数值观察。"],"prerequisites":["K-0001","K-0002"],"relations":[{"type":"motivates","target":"K-0015"},{"type":"contrasts_with","target":"K-0006"},{"type":"motivates","target":"K-0016"}],"authority":{"status":"reference_only","receipt":null,"shared_result":null},"source_refs":["A. Weil, Sur les courbes algébriques et les variétés qui s'en déduisent, Hermann, Paris (1948).","P. Deligne, La conjecture de Weil. I, Publ. Math. IHÉS 43 (1974), 273–307, DOI 10.1007/BF02684373.","P. Deligne, La conjecture de Weil. II, Publ. Math. IHÉS 52 (1980), 137–252, DOI 10.1007/BF02684780."],"cannot_imply":["有限域证明不能通过类比自动迁移到整数上的 Riemann ζ。","给出一个形式谱模型而未证明自伴性、谱等同和完备性，不能复制 Weil/Deligne 机制。","函数域的成功不降低经典 RH 的量词或开放状态。"]}
