{"schema":"jin-math-knowledge-node/v1","knowledge_id":"K-0004","kind":"theorem","title":"临界线零点比例：Hardy 至 2026 年预印本","classification":{"subject":{"scheme":"MSC2020","primary":"11M26","secondary":["11M06"]},"object_tags":["riemann-zeta-function","critical-line-zero","simple-zero"],"method_tags":["mollifier","mean-value-estimate","finite-compression","formal-verification"]},"statement":"临界线上的零点数量经历了由“无限多个”到“正比例”的推进。Hardy（1914）证明临界线上有\n无限多个零点；Selberg 证明正比例；Levinson（1974）把按重数计的比例推进到超过 \\(1/3\\)；\nConrey（1989）推进到超过 \\(2/5\\)；Bui–Conrey–Young（2011）得到超过 \\(41\\%\\)；\nPratt–Robles–Zaharescu–Zeindler（2020）得到略高于 \\(5/12\\)。\n\n截至 2026-08-29，Alpöge–Furman 的 arXiv:2608.13637v2 声称无条件证明：\n至少 \\(2/3\\) 的非平凡零点（按重数）是临界线上的单零点，至少 \\(5/6\\) 的零点互异；\n在其 Montgomery–Taylor window 优化下常数为 0.6725 与 0.8362，并提供 Lean 4 形式化。\nMichael Devine 于 2026-08-23 在 Zenodo 发布的预印本进一步声称 0.673399 的单临界零点下界。\n这两个 2026 结果尚未由本仓库独立审计，故只作来源报告，不覆盖此前正式文献的权威等级。","assumptions":["各比例的分母、是否按重数、是否要求简单、是否计互异零点必须使用原文口径。","2026 两项材料按预印本而非已独立验证定理处理。"],"scope":"经典和现代“临界线上有多少零点”的结果谱系；截至 2026-08-29。","conventions":["\\(N_0(T)\\) 表示临界线上高度不超过 \\(T\\) 的零点数，具体是否计重数以来源为准。","“simple and on the critical line”比“on the critical line”更强。"],"prerequisites":["K-0001","K-0002"],"relations":[{"type":"uses_method","target":"K-0015"},{"type":"motivates","target":"K-0013"},{"type":"contrasts_with","target":"K-0006"},{"type":"motivates","target":"K-0016"}],"authority":{"status":"reference_only","receipt":null,"shared_result":null},"source_refs":["G. H. Hardy, Sur les zéros de la fonction ζ(s) de Riemann, C. R. Acad. Sci. Paris 158 (1914), 1012–1014.","A. Selberg, On the zeros of Riemann's zeta-function, Skr. Norske Vid. Akad. Oslo I (1942), no. 10.","N. Levinson, More than one third of zeros of Riemann's zeta-function are on σ=1/2, Adv. Math. 13 (1974), 383–436, DOI 10.1016/0001-8708(74)90074-7.","J. B. Conrey, More than two fifths of the zeros of the Riemann zeta function are on the critical line, J. Reine Angew. Math. 399 (1989), 1–26.","H. M. Bui, J. B. Conrey, M. P. Young, More than 41% of the zeros of the zeta function are on the critical line, Acta Arith. 150 (2011), 35–64; arXiv:1002.4127.","K. Pratt, N. Robles, A. Zaharescu, D. Zeindler, More than five-twelfths of the zeros of ζ are on the critical line, Res. Math. Sci. 7 (2020), 2; arXiv:1802.10521.","L. Alpöge, R. Furman, More than two thirds of the zeta zeros are simple and on the critical line, arXiv:2608.13637v2 (2026-08-19), preprint with Lean formalization.","M. Devine, An Unconditional 67.3399% Bound and Conditional Advances Beyond 67.92% for Simple Critical Zeros of the Riemann Zeta Function, Zenodo 10.5281/zenodo.22066689, version 1.0.3 (2026-08-23), preprint."],"cannot_imply":["任何小于 100% 的比例下界都允许存在无限多个离线零点，因而不能推出 RH。","“至少若干比例为单临界零点”不能推出所有零点简单。","形式化代码的存在不自动证明其数学模型、依赖和源定理已由本仓库独立审计。","Devine 预印本的数值证书、方法与作者声明尚未完成独立来源和数学验证。"]}
