{"schema":"jin-math-knowledge-node/v1","knowledge_id":"K-0006","kind":"computational_fact","title":"严格有限验证：RH 至高度 \\(3\\times10^{12}\\)","classification":{"subject":{"scheme":"MSC2020","primary":"11Y35","secondary":["11M26","65G30"]},"object_tags":["riemann-zeta-function","zero-verification","interval-arithmetic"],"method_tags":["turing-method","interval-arithmetic","rigorous-computation"]},"statement":"Platt–Trudgian 使用区间算术与 Turing 方法严格验证：所有满足\n\\(0<\\Im\\rho\\le 3\\times10^{12}\\) 的 ζ 非平凡零点都位于临界线。\n论文的精确计算高度为约 \\(3.0001753328\\times10^{12}\\)，Clay 的公众页面将相应规模概述为\n前 \\(10^{13}\\) 个非平凡零点已检查。该结果是有穷域内的严格计算定理，而不是浮点抽样。\n其证明结构同时需要：找到临界线零点、用零点计数/Turing 方法证明没有漏掉同高度区间内的零点、\n以及对舍入与截断误差作严格控制。","assumptions":["仅覆盖来源声明的有限高度区间。","计算正确性依赖实现、区间界、零点计数和证书链。"],"scope":"ζ 非平凡零点的严格有限高度验证；目前基线采用 Platt–Trudgian 发表记录。","conventions":["“RH true up to \\(H\\)”表示 \\(0<\\Im\\rho\\le H\\) 的所有非平凡零点均在临界线。","bounded_check 与全称命题严格分离。"],"prerequisites":["K-0001","K-0002"],"relations":[{"type":"contrasts_with","target":"K-0004"},{"type":"applies_to","target":"K-0003"},{"type":"applies_to","target":"K-0012"},{"type":"uses_method","target":"K-0015"}],"authority":{"status":"reference_only","receipt":null,"shared_result":null},"source_refs":["D. Platt, T. Trudgian, The Riemann hypothesis is true up to 3·10^12, Bull. Lond. Math. Soc. 53 (2021), 792–797, DOI 10.1112/blms.12460; arXiv:2004.09765.","A. M. Turing, Some calculations of the Riemann zeta-function, Proc. London Math. Soc. (2) 48 (1943), 180–197.","Clay Mathematics Institute, Riemann Hypothesis problem page, observed 2026-08-29."],"cannot_imply":["任何有限高度 \\(H\\) 的验证都不能排除 \\(H\\) 以上的反例。","观察到大量简单零点不能推出全部零点简单。","计算记录不能替代无穷量词的概念性证明。"]}
