{"schema":"jin-math-knowledge-node/v1","knowledge_id":"K-0007","kind":"equivalence","title":"素数计数误差与显式公式中的 RH 等价边界","classification":{"subject":{"scheme":"MSC2020","primary":"11N05","secondary":["11M26","11M06"]},"object_tags":["prime-counting-function","chebyshev-function","explicit-formula","riemann-zeta-function"],"method_tags":["explicit-formula","contour-integration","tauberian-method"]},"statement":"ζ 的零点通过显式公式控制素数计数误差。经典 von Koch 型表述给出：\nRH 等价于\n\\[\n\\pi(x)=\\operatorname{Li}(x)+O(\\sqrt{x}\\log x),\n\\]\n也等价于相应的 Chebyshev 函数平方根尺度估计，例如\n\\[\n\\psi(x)=x+O(\\sqrt{x}\\log^2 x).\n\\]\n在假设 RH 下，Schoenfeld 给出了显式常数版本，如对适当 \\(x\\) 范围\n\\(|\\psi(x)-x|\\le(8\\pi)^{-1}\\sqrt{x}\\log^2x\\)。\n无条件的素数定理误差来自无零区域，尺度明显弱于上述平方根级。","assumptions":["大 O 常数允许依赖固定约定但不依赖 x。","不同计数函数之间的对数因子和起始范围必须保留。"],"scope":"主要素数计数函数的 RH 等价误差与条件显式界；不枚举所有同义变体。","conventions":["\\(\\pi(x)=\\#\\{p\\le x\\}\\)。","\\(\\operatorname{Li}(x)\\) 取通常主值约定。","\\(\\psi(x)=\\sum_{n\\le x}\\Lambda(n)\\)。"],"prerequisites":["K-0001","K-0002"],"relations":[{"type":"equivalent_to","target":"K-0001"},{"type":"uses_method","target":"K-0015"},{"type":"contrasts_with","target":"K-0003"},{"type":"applies_to","target":"K-0016"}],"authority":{"status":"reference_only","receipt":null,"shared_result":null},"source_refs":["H. von Koch, Sur la distribution des nombres premiers, Acta Math. 24 (1901), 159–182.","L. Schoenfeld, Sharper bounds for the Chebyshev functions θ(x) and ψ(x). II, Math. Comp. 30 (1976), 337–360, DOI 10.2307/2005976.","H. M. Edwards, Riemann's Zeta Function, Academic Press (1974), explicit-formula and equivalence chapters."],"cannot_imply":["已知的无条件素数定理误差不达到 RH 等价的平方根尺度。","在有限 x 范围验证误差界不能推出对所有充分大 x 的结论。","把某一计数函数的较弱误差改善一个常数或对数因子，不自动达到 RH。"]}
