{"schema":"jin-math-knowledge-node/v1","knowledge_id":"K-0011","kind":"equivalence","title":"Nyman–Beurling、Báez-Duarte 与逼近论判据","classification":{"subject":{"scheme":"MSC2020","primary":"46E30","secondary":["11M26","30H20"]},"object_tags":["fractional-part-function","hilbert-space","riemann-zeta-function"],"method_tags":["functional-analysis","closure-criterion","approximation-theory"]},"statement":"Nyman–Beurling 判据把 RH 等价地表述为 \\(L^2(0,1)\\) 中的闭包问题：\n常数函数（按标准归一化可写为区间指示函数）是否属于由分数部分函数\n\\(\\{\\theta/x\\}\\) 的特定线性组合所生成的闭包。\nBáez-Duarte 将连续参数判据加强/离散化到 \\(\\theta=1/k\\) 的序列，并导出可计算的最佳逼近距离。\nRiesz 与 Báez-Duarte 还给出若干由 Möbius 系数构造的整函数增长判据。\n该路线把零点位置转换成 Hilbert 空间稠密性或定量逼近速率，但证明距离趋零仍是全局难点。","assumptions":["函数空间、生成元符号、线性约束和归一化采用各原始判据的精确版本。","闭包在 \\(L^2(0,1)\\) 范数中理解。"],"scope":"函数分析/逼近论等价路线的主干；不把众多等价重写逐一列为独立结论。","conventions":["\\(\\{y\\}=y-\\lfloor y\\rfloor\\) 表示分数部分。","有限基底最小距离与闭包中的极限距离分开。"],"prerequisites":["K-0001"],"relations":[{"type":"equivalent_to","target":"K-0001"},{"type":"uses_method","target":"K-0015"},{"type":"motivates","target":"K-0016"}],"authority":{"status":"reference_only","receipt":null,"shared_result":null},"source_refs":["B. Nyman, On the one-dimensional translation group and semi-group in certain function spaces, Thesis, Uppsala (1950).","A. Beurling, A closure problem related to the Riemann zeta-function, Proc. Nat. Acad. Sci. USA 41 (1955), 312–314.","L. Báez-Duarte, A strengthening of the Nyman–Beurling criterion for the Riemann hypothesis, Atti Accad. Naz. Lincei Rend. Lincei Mat. Appl. 14 (2003), 5–11; arXiv:math/0505453.","M. Riesz, Sur l'hypothèse de Riemann, Acta Math. 40 (1916), 185–190."],"cannot_imply":["任意固定维数的逼近或大量数值优化不能证明闭包成员关系。","观察到逼近距离下降不等于获得足够的严格渐近速率。","离散化判据的等价性依赖完整函数族与极限过程，不能截断后直接提升为 RH。"]}
