{"schema":"jin-math-knowledge-node/v1","knowledge_id":"K-0015","kind":"reference_map","title":"主要研究路线、已取得能力与结构性障碍","classification":{"subject":{"scheme":"MSC2020","primary":"11M26","secondary":["11M06","11N05"]},"object_tags":["riemann-zeta-function","proof-strategy","research-route","obstruction"],"method_tags":["mollifier","zero-density","explicit-formula","spectral-theory","positivity","jensen-polynomial"]},"statement":"当前主路线可按其“能控制什么”组织，而不能只列方法名：\n\n1. mollifier/矩方法控制临界线上零点比例；瓶颈是可处理 mollifier 长度、ζ 高阶矩与离对角相关项。\n2. Dirichlet 多项式大值与零密度控制离线零点的平均数量；密度估计本身不把数量降为零。\n3. 显式公式、Li/Weil 正性把零点问题变成无限族正性；核心缺口是获得覆盖完整测试空间的统一证书。\n4. Hilbert–Pólya/谱路线寻求自伴算子，其谱精确对应零点虚部；类比、迹公式片段或形式算子不足，\n   必须同时证明定义域、自伴性、谱等同、重数和完备性。\n5. Nyman–Beurling 路线把 RH 变成 \\(L^2\\) 闭包/逼近率；有限维优化无法替代极限定理。\n6. de Bruijn–Newman 热流把 RH 压缩为 \\(\\Lambda=0\\)；当前只有 \\(\\Lambda\\ge0\\) 与正上界。\n7. Pólya/Jensen 多项式路线把 RH 等价为所有 \\(d,n\\) 的双参数超曲性。Griffin–Ono–Rolen–Zagier\n   证明每个固定次数的密度 1 子族及全部 \\(d\\le8\\)；Holland 的 2026-08 预印本声称在\n   \\(n^3\\log^2(n+2)\\ge Kd^5\\) 的楔形区域获得超曲性，但补集仍包含无穷参数。\n8. 计算、区间证书和形式化适合验证有限高度、常数与局部引理；不能自行消除无穷量词。\n9. 随机矩阵和函数域几何提供结构预测与原型；仍缺向经典 ζ 的严格桥梁。","assumptions":["路线分类按证明义务而非学术流派划分。","预印本结果仅作为路线更新，不作为仓库独立验证结论。"],"scope":"截至 2026-08-29 的路线能力矩阵与失败边界；为后续选择最小 frontier 服务。","conventions":["“obstruction”表示当前证明技术的明确义务/边界，不表示已证明该路线永远不可能成功。","任何等价改写都必须说明新的无穷量词落在哪里。"],"prerequisites":["K-0001","K-0002","K-0003","K-0004","K-0005","K-0006","K-0007","K-0008","K-0009","K-0010","K-0011","K-0012","K-0013","K-0014"],"relations":[{"type":"motivates","target":"K-0016"},{"type":"applies_to","target":"K-0003"},{"type":"applies_to","target":"K-0004"},{"type":"applies_to","target":"K-0005"},{"type":"applies_to","target":"K-0007"},{"type":"applies_to","target":"K-0010"},{"type":"applies_to","target":"K-0011"},{"type":"applies_to","target":"K-0012"},{"type":"applies_to","target":"K-0013"}],"authority":{"status":"reference_only","receipt":null,"shared_result":null},"source_refs":["J. B. Conrey, The Riemann Hypothesis, Notices Amer. Math. Soc. 50 (2003), 341–353.","E. Bombieri, Clay Mathematics Institute official RH problem description (2000).","M. Griffin, K. Ono, L. Rolen, D. Zagier, Jensen polynomials for the Riemann zeta function and other sequences, Proc. Natl. Acad. Sci. USA 116 (2019), 11103–11110, DOI 10.1073/pnas.1902572116; arXiv:1902.07321.","J. Holland, A new hyperbolicity wedge and a joint semicircle limit for Jensen polynomials of Riemann's ξ-function, arXiv:2608.08682 (2026-08), preprint.","D. Farmer, Jensen polynomials are not a viable route to proving the Riemann Hypothesis, arXiv:2008.07206."],"cannot_imply":["路线图不证明任一路线可闭合 RH。","技术瓶颈不是不可能性定理；除非另有独立验证的边界证明，不得宣称路线已被永久排除。","覆盖一个增长楔形、固定次数或密度 1 子族仍不能覆盖全部双参数。","方法之间的类比关系不能作为逻辑蕴含边。"]}
