{"schema":"jin-math-knowledge-node/v1","knowledge_id":"K-0008","kind":"equivalence","title":"Möbius 求和、Mertens 函数与被反驳的 Mertens 猜想","classification":{"subject":{"scheme":"MSC2020","primary":"11N37","secondary":["11M26"]},"object_tags":["mobius-function","mertens-function","riemann-zeta-function"],"method_tags":["dirichlet-series","perron-formula","explicit-formula"]},"statement":"令 \\(M(x)=\\sum_{n\\le x}\\mu(n)\\)。RH 等价于：对每个 \\(\\varepsilon>0\\)，\n\\[\nM(x)=O_\\varepsilon(x^{1/2+\\varepsilon}).\n\\]\n这一等价来自 \\(1/\\zeta(s)=\\sum\\mu(n)n^{-s}\\) 的解析延拓与 Perron/部分求和论证。\n必须与更强且已被反驳的 Mertens 猜想区分：\\(|M(x)|<\\sqrt{x}\\) 对所有 \\(x>1\\) 并不成立；\nOdlyzko–te Riele 在 1985 年无须给出显式最小反例即证明其为假。\n无条件 Mertens 和估计由 ζ 的无零区域导出，但尚未达到 \\(x^{1/2+\\varepsilon}\\) 的 RH 尺度。","assumptions":["采用通常 Möbius 函数与实数 x 的截断求和。"],"scope":"Möbius 求和的 RH 等价表述、无条件边界和一个重要错误强猜想的反例史。","conventions":["\\(\\mu(n)\\) 为 Möbius 函数。","“Mertens conjecture”特指点态常数 1 的平方根界，不等同于 RH 等价的大 O-ε 表述。"],"prerequisites":["K-0001","K-0002"],"relations":[{"type":"equivalent_to","target":"K-0001"},{"type":"uses_method","target":"K-0015"},{"type":"contrasts_with","target":"K-0003"}],"authority":{"status":"reference_only","receipt":null,"shared_result":null},"source_refs":["J. E. Littlewood, Quelques conséquences de l'hypothèse que la fonction ζ(s) de Riemann n'a pas de zéros dans le demi-plan Re(s)>1/2, C. R. Acad. Sci. Paris 154 (1912), 263–266.","A. M. Odlyzko, H. J. J. te Riele, Disproof of the Mertens conjecture, J. Reine Angew. Math. 357 (1985), 138–160, DOI 10.1515/crll.1985.357.138.","E. C. Titchmarsh, The Theory of the Riemann Zeta-function, 2nd ed., Oxford University Press (1986)."],"cannot_imply":["Mertens 猜想被反驳不反驳 RH；它比 RH 所等价的 \\(x^{1/2+\\varepsilon}\\) 族更强。","有限范围内 \\(|M(x)|<\\sqrt{x}\\) 不能恢复该已反驳全称命题。","较弱的无条件消去估计不能推出 RH。"]}
